{"schema_version":"0.3","migration_type":"V0_2_TO_V0_3","source":{"path":"receipts/resume_replay/LEDGER_ENTRY_003_GITHUB_CI_RUN_32243549719.json","source_receipt_hash":"6efecee831eb502211e3a8ff6282be4950b564199e03fdfaeeee780cbcbe4246","source_schema_version":"0.2"},"target":{"normalized_object_hash":"a444ecb2695b70a73492860d1812fea2489f9b31f868bafaff45f7a7f418d88d","target_schema_version":"0.3"},"preservation":{"source_hash_match":true,"execution_identity_preserved":true,"evidence_state_unchanged":true,"production_flag_unchanged":true,"employment_flag_unchanged":true,"authority_flag_unchanged":true},"historical_derived_state":{"old_ledger_entry":"LEDGER_ENTRY_003","old_observer_verdict":"PASS"},"migration_result":"PASS","migration_reason":"STRUCTURAL_PRESERVATION_CONFIRMED","timestamp":"2026-08-19T11:20:00Z","prior_migration_receipt_hash":"8a39afecd2629a9a8ff34a3189b5eb1ce232349eb5068028d1f3c6ffce27a1d1","migration_receipt_hash":"791fa8491b2297c5d1fb1eb89c6eaf67d008d6a55239a52b263feed21063a086"}
